{
  "contract": "ideia.task-manifest/1",
  "manifest_id": "mft_123e4567-e89b-42d3-a456-426614174000",
  "project_id": "prj_123e4567-e89b-42d3-a456-426614174000",
  "workspace_id": "wsp_123e4567-e89b-42d3-a456-426614174000",
  "principal_id": "prn_123e4567-e89b-42d3-a456-426614174000",
  "objective": "default",
  "workspace_root": "default",
  "scope": {
    "read_paths": [
      "default"
    ],
    "write_paths": [
      "default"
    ]
  },
  "criteria": [
    {
      "criterion_id": "crt_123e4567-e89b-42d3-a456-426614174000",
      "description": "default",
      "required": true,
      "verification": {
        "method": "command",
        "verifier_id": "default",
        "verifier_version": "default"
      }
    }
  ],
  "governance": {
    "bundle_id": "default",
    "bundle_fingerprint": "sha256:0000000000000000000000000000000000000000000000000000000000000000"
  },
  "budget": {
    "budget_set_id": "bgt_123e4567-e89b-42d3-a456-426614174000",
    "budget_fingerprint": "sha256:0000000000000000000000000000000000000000000000000000000000000000"
  },
  "timeouts": {
    "task_timeout_ms": 1,
    "operation_timeout_ms": 1,
    "cancellation_grace_ms": 0
  },
  "policy": {
    "policy_id": "default",
    "policy_version": "default",
    "policy_fingerprint": "sha256:0000000000000000000000000000000000000000000000000000000000000000"
  },
  "provider": {
    "provider_id": "default",
    "model_id": "model_123e4567-e89b-42d3-a456-426614174000",
    "config_fingerprint": "sha256:0000000000000000000000000000000000000000000000000000000000000000"
  },
  "sandbox": {
    "profile_id": "default",
    "profile_version": "default",
    "profile_fingerprint": "sha256:0000000000000000000000000000000000000000000000000000000000000000"
  },
  "allowed_tools": [
    {
      "tool_id": "default",
      "tool_version": "default"
    }
  ],
  "created_at": "2024-01-01T00:00:00.000Z"
}
